\c spqr-console

		SPQR router admin console
	Here you can configure your routing rules
------------------------------------------------
	You can find documentation here 
https://github.com/pg-sharding/spqr/tree/master/docs

CREATE DISTRIBUTION ds1 COLUMN TYPES integer;
    add distribution    
------------------------
 distribution id -> ds1
(1 row)

CREATE KEY RANGE FROM 301 ROUTE TO sh4 FOR DISTRIBUTION ds1;
 add key range 
---------------
 bound -> 301
(1 row)

CREATE KEY RANGE FROM 201 ROUTE TO sh3 FOR DISTRIBUTION ds1;
 add key range 
---------------
 bound -> 201
(1 row)

CREATE KEY RANGE FROM 101 ROUTE TO sh2 FOR DISTRIBUTION ds1;
 add key range 
---------------
 bound -> 101
(1 row)

CREATE KEY RANGE FROM 1 ROUTE TO sh1 FOR DISTRIBUTION ds1;
 add key range 
---------------
 bound -> 1
(1 row)

ALTER DISTRIBUTION ds1 ATTACH RELATION table1 DISTRIBUTION KEY id;
       attach table        
---------------------------
 relation name   -> table1
 distribution id -> ds1
(2 rows)

\c regress
CREATE TABLE table1(id INT PRIMARY KEY);
NOTICE: send query to shard(s) : sh1,sh2,sh3,sh4
COPY table1 (id) FROM STDIN;
NOTICE: send query to shard(s) : sh1,sh2,sh3,sh4
-- should fail
SET __spqr__engine_v2 TO false;
BEGIN;
DELETE FROM table1; 
ERROR:  client processing error: cannot route in an active transaction, tx status ERROR
ROLLBACK;
BEGIN;
DELETE FROM table1 /* __spqr__engine_v2: off */;
ERROR:  client processing error: cannot route in an active transaction, tx status ERROR
ROLLBACK;
-- should succeed
BEGIN;
DELETE FROM table1 /* __spqr__engine_v2: on  */; 
NOTICE: send query to shard(s) : sh1,sh2,sh3,sh4
SELECT id FROM table1 ORDER BY id;
NOTICE: send query to shard(s) : sh1,sh2,sh3,sh4
 id 
----
(0 rows)

ROLLBACK;
-- should fail
BEGIN;
DELETE FROM table1; 
ERROR:  client processing error: cannot route in an active transaction, tx status ERROR
ROLLBACK;
-- now success
SET __spqr__engine_v2 TO true;
BEGIN;
DELETE FROM table1; 
NOTICE: send query to shard(s) : sh1,sh2,sh3,sh4
ROLLBACK;
SELECT id FROM table1 ORDER BY id;
NOTICE: send query to shard(s) : sh1,sh2,sh3,sh4
 id  
-----
   1
   2
   3
 100
 101
 102
 103
 200
 201
 202
 300
 301
 302
(13 rows)

-- should all succeed
INSERT INTO table1 (id) VALUES(50),(51);
NOTICE: send query to shard(s) : sh1
INSERT INTO table1 (id) VALUES(150),(151);
NOTICE: send query to shard(s) : sh2
INSERT INTO table1 (id) VALUES(250),(251);
NOTICE: send query to shard(s) : sh3
INSERT INTO table1 (id) VALUES(350),(351);
NOTICE: send query to shard(s) : sh4
WITH a AS (SELECT 1) INSERT INTO table1 (id) VALUES(52),(53);
NOTICE: send query to shard(s) : sh1
TRUNCATE table1;
NOTICE: send query to shard(s) : sh1,sh2,sh3,sh4
-- disable v1 logic, now CTE fails
SET __spqr__preferred_engine to 'v2';
INSERT INTO table1 (id) VALUES(50),(51);
NOTICE: send query to shard(s) : sh1
INSERT INTO table1 (id) VALUES(150),(151);
NOTICE: send query to shard(s) : sh2
INSERT INTO table1 (id) VALUES(250),(251);
NOTICE: send query to shard(s) : sh3
INSERT INTO table1 (id) VALUES(350),(351);
NOTICE: send query to shard(s) : sh4
WITH a AS (SELECT 1) INSERT INTO table1 (id) VALUES(52),(53);
ERROR:  client processing error: error processing query 'WITH a AS (SELECT 1) INSERT INTO table1 (id) VALUES(52),(53);': too complex query to route, tx status IDLE
DROP TABLE table1 CASCADE;
NOTICE: send query to shard(s) : sh1,sh2,sh3,sh4
\c spqr-console

		SPQR router admin console
	Here you can configure your routing rules
------------------------------------------------
	You can find documentation here 
https://github.com/pg-sharding/spqr/tree/master/docs

DROP DISTRIBUTION ALL CASCADE;
   drop distribution    
------------------------
 distribution id -> ds1
(1 row)

