\c spqr-console

		SPQR router admin console
	Here you can configure your routing rules
------------------------------------------------
	You can find documentation here 
https://github.com/pg-sharding/spqr/tree/master/docs

-- test both ways of ref relation crete syntax
CREATE REFERENCE TABLE test_ref_rel;
   create reference table    
-----------------------------
 table    -> test_ref_rel
 shard id -> sh1,sh2,sh3,sh4
(2 rows)

-- partial ref relation test
CREATE REFERENCE RELATION test_ref_rel_part ON sh1, sh3;
    create reference table     
-------------------------------
 table    -> test_ref_rel_part
 shard id -> sh1,sh3
(2 rows)

\c regress
CREATE TABLE test_ref_rel(i int, j int);
NOTICE: send query to shard(s) : sh1,sh2,sh3,sh4
CREATE TABLE test_ref_rel_part(i int, j int);
NOTICE: send query to shard(s) : sh1,sh2,sh3,sh4
COPY test_ref_rel FROM STDIN;
NOTICE: send query to shard(s) : sh1,sh2,sh3,sh4
COPY test_ref_rel_part FROM STDIN;
NOTICE: send query to shard(s) : sh1,sh2,sh3,sh4
set __spqr__default_route_behaviour to allow;
SELECT * FROM test_ref_rel ORDER BY i, j /*__spqr__execute_on: sh1 */;
NOTICE: send query to shard(s) : sh1
 i | j 
---+---
 1 | 2
 2 | 3
 3 | 4
 4 | 5
(4 rows)

set __spqr__default_route_behaviour to block;
SELECT * FROM test_ref_rel ORDER BY i, j /*__spqr__execute_on: sh2 */;
NOTICE: send query to shard(s) : sh2
 i | j 
---+---
 1 | 2
 2 | 3
 3 | 4
 4 | 5
(4 rows)

INSERT INTO test_ref_rel VALUES(1) /* __spqr__engine_v2: true */;
NOTICE: send query to shard(s) : sh1,sh2,sh3,sh4
INSERT INTO test_ref_rel SELECT 1 /* __spqr__engine_v2: true */;
NOTICE: send query to shard(s) : sh1,sh2,sh3,sh4
SELECT * FROM test_ref_rel ORDER BY i, j /*__spqr__execute_on: sh1 */;
NOTICE: send query to shard(s) : sh1
 i | j 
---+---
 1 | 2
 1 |  
 1 |  
 2 | 3
 3 | 4
 4 | 5
(6 rows)

SELECT * FROM test_ref_rel ORDER BY i, j /*__spqr__execute_on: sh2 */;
NOTICE: send query to shard(s) : sh2
 i | j 
---+---
 1 | 2
 1 |  
 1 |  
 2 | 3
 3 | 4
 4 | 5
(6 rows)

SELECT * FROM test_ref_rel ORDER BY i, j /*__spqr__execute_on: sh3 */;
NOTICE: send query to shard(s) : sh3
 i | j 
---+---
 1 | 2
 1 |  
 1 |  
 2 | 3
 3 | 4
 4 | 5
(6 rows)

SELECT * FROM test_ref_rel ORDER BY i, j /*__spqr__execute_on: sh4 */;
NOTICE: send query to shard(s) : sh4
 i | j 
---+---
 1 | 2
 1 |  
 1 |  
 2 | 3
 3 | 4
 4 | 5
(6 rows)

UPDATE test_ref_rel SET i = i + 1 /* __spqr__engine_v2: true */;
NOTICE: send query to shard(s) : sh1,sh2,sh3,sh4
UPDATE test_ref_rel SET i = - i WHERE i IN (3, 4) /* __spqr__engine_v2: true */;
NOTICE: send query to shard(s) : sh1,sh2,sh3,sh4
SELECT * FROM test_ref_rel ORDER BY i, j /*__spqr__execute_on: sh1 */;
NOTICE: send query to shard(s) : sh1
 i  | j 
----+---
 -4 | 4
 -3 | 3
  2 | 2
  2 |  
  2 |  
  5 | 5
(6 rows)

SELECT * FROM test_ref_rel ORDER BY i, j /*__spqr__execute_on: sh2 */;
NOTICE: send query to shard(s) : sh2
 i  | j 
----+---
 -4 | 4
 -3 | 3
  2 | 2
  2 |  
  2 |  
  5 | 5
(6 rows)

SELECT * FROM test_ref_rel ORDER BY i, j /*__spqr__execute_on: sh3 */;
NOTICE: send query to shard(s) : sh3
 i  | j 
----+---
 -4 | 4
 -3 | 3
  2 | 2
  2 |  
  2 |  
  5 | 5
(6 rows)

SELECT * FROM test_ref_rel ORDER BY i, j /*__spqr__execute_on: sh4 */;
NOTICE: send query to shard(s) : sh4
 i  | j 
----+---
 -4 | 4
 -3 | 3
  2 | 2
  2 |  
  2 |  
  5 | 5
(6 rows)

DELETE FROM test_ref_rel WHERE i = 2 /* __spqr__engine_v2: true */;
NOTICE: send query to shard(s) : sh1,sh2,sh3,sh4
-- check data
SELECT * FROM test_ref_rel ORDER BY i, j /*__spqr__execute_on: sh1 */;
NOTICE: send query to shard(s) : sh1
 i  | j 
----+---
 -4 | 4
 -3 | 3
  5 | 5
(3 rows)

SELECT * FROM test_ref_rel ORDER BY i, j /*__spqr__execute_on: sh2 */;
NOTICE: send query to shard(s) : sh2
 i  | j 
----+---
 -4 | 4
 -3 | 3
  5 | 5
(3 rows)

SELECT * FROM test_ref_rel ORDER BY i, j /*__spqr__execute_on: sh3 */;
NOTICE: send query to shard(s) : sh3
 i  | j 
----+---
 -4 | 4
 -3 | 3
  5 | 5
(3 rows)

SELECT * FROM test_ref_rel ORDER BY i, j /*__spqr__execute_on: sh4 */;
NOTICE: send query to shard(s) : sh4
 i  | j 
----+---
 -4 | 4
 -3 | 3
  5 | 5
(3 rows)

INSERT INTO test_ref_rel_part VALUES(1) /* __spqr__engine_v2: true */;
NOTICE: send query to shard(s) : sh1,sh3
INSERT INTO test_ref_rel_part SELECT 1 /* __spqr__engine_v2: true */;
NOTICE: send query to shard(s) : sh1,sh3
-- check data on partially distributed reference relation
SELECT * FROM test_ref_rel_part ORDER BY i, j /*__spqr__execute_on: sh1 */;
NOTICE: send query to shard(s) : sh1
 i | j 
---+---
 1 | 2
 1 |  
 1 |  
 2 | 3
 3 | 4
 4 | 5
(6 rows)

SELECT * FROM test_ref_rel_part ORDER BY i, j /*__spqr__execute_on: sh2 */;
NOTICE: send query to shard(s) : sh2
 i | j 
---+---
(0 rows)

SELECT * FROM test_ref_rel_part ORDER BY i, j /*__spqr__execute_on: sh3 */;
NOTICE: send query to shard(s) : sh3
 i | j 
---+---
 1 | 2
 1 |  
 1 |  
 2 | 3
 3 | 4
 4 | 5
(6 rows)

SELECT * FROM test_ref_rel_part ORDER BY i, j /*__spqr__execute_on: sh4 */;
NOTICE: send query to shard(s) : sh4
 i | j 
---+---
(0 rows)

/* Check exeution for returning clause */
TRUNCATE test_ref_rel;
NOTICE: send query to shard(s) : sh1,sh2,sh3,sh4
INSERT INTO test_ref_rel VALUES(1,3),(2,4),(3,-1) RETURNING *;
NOTICE: send query to shard(s) : sh1,sh2,sh3,sh4
 i | j  
---+----
 1 |  3
 2 |  4
 3 | -1
(3 rows)

-- check data on partially distributed reference relation
SELECT * FROM test_ref_rel ORDER BY i, j /*__spqr__execute_on: sh1 */;
NOTICE: send query to shard(s) : sh1
 i | j  
---+----
 1 |  3
 2 |  4
 3 | -1
(3 rows)

SELECT * FROM test_ref_rel ORDER BY i, j /*__spqr__execute_on: sh2 */;
NOTICE: send query to shard(s) : sh2
 i | j  
---+----
 1 |  3
 2 |  4
 3 | -1
(3 rows)

SELECT * FROM test_ref_rel ORDER BY i, j /*__spqr__execute_on: sh3 */;
NOTICE: send query to shard(s) : sh3
 i | j  
---+----
 1 |  3
 2 |  4
 3 | -1
(3 rows)

SELECT * FROM test_ref_rel ORDER BY i, j /*__spqr__execute_on: sh4 */;
NOTICE: send query to shard(s) : sh4
 i | j  
---+----
 1 |  3
 2 |  4
 3 | -1
(3 rows)

DROP TABLE test_ref_rel;
NOTICE: send query to shard(s) : sh1,sh2,sh3,sh4
DROP TABLE test_ref_rel_part;
NOTICE: send query to shard(s) : sh1,sh2,sh3,sh4
\c spqr-console

		SPQR router admin console
	Here you can configure your routing rules
------------------------------------------------
	You can find documentation here 
https://github.com/pg-sharding/spqr/tree/master/docs

SHOW reference_relations;
    table name     | schema version |      shards       
-------------------+----------------+-------------------
 test_ref_rel      | 1              | [sh1 sh2 sh3 sh4]
 test_ref_rel_part | 1              | [sh1 sh3]
(2 rows)

DROP DISTRIBUTION ALL CASCADE;
       drop distribution       
-------------------------------
 distribution id -> REPLICATED
(1 row)

DROP KEY RANGE ALL;
 drop key range 
----------------
(0 rows)

