\c spqr-console

		SPQR router admin console
	Here you can configure your routing rules
------------------------------------------------
	You can find documentation here 
https://github.com/pg-sharding/spqr/tree/master/docs

-- test both ways of ref relation crete syntax
CREATE REFERENCE TABLE test_ref_rel;
          attach table           
---------------------------------
 relation name   -> test_ref_rel
 distribution id -> REPLICATED
(2 rows)

\c regress
CREATE TABLE test_ref_rel(i int, j int);
COPY test_ref_rel FROM STDIN;
set __spqr__default_route_behaviour to allow;
SELECT * FROM test_ref_rel ORDER BY i, j /*__spqr__execute_on: sh1 */;
 i | j 
---+---
 1 | 2
 2 | 3
 3 | 4
 4 | 5
(4 rows)

set __spqr__default_route_behaviour to block;
SELECT * FROM test_ref_rel ORDER BY i, j /*__spqr__execute_on: sh2 */;
 i | j 
---+---
 1 | 2
 2 | 3
 3 | 4
 4 | 5
(4 rows)

INSERT INTO test_ref_rel VALUES(1) /* __spqr__engine_v2: true */;
INSERT INTO test_ref_rel SELECT 1 /* __spqr__engine_v2: true */;
SELECT * FROM test_ref_rel ORDER BY i, j /*__spqr__execute_on: sh1 */;
 i | j 
---+---
 1 | 2
 1 |  
 1 |  
 2 | 3
 3 | 4
 4 | 5
(6 rows)

SELECT * FROM test_ref_rel ORDER BY i, j /*__spqr__execute_on: sh2 */;
 i | j 
---+---
 1 | 2
 1 |  
 1 |  
 2 | 3
 3 | 4
 4 | 5
(6 rows)

UPDATE test_ref_rel SET i = i + 1 /* __spqr__engine_v2: true */;
UPDATE test_ref_rel SET i = - i WHERE i IN (3, 4) /* __spqr__engine_v2: true */;
SELECT * FROM test_ref_rel ORDER BY i, j /*__spqr__execute_on: sh1 */;
 i  | j 
----+---
 -4 | 4
 -3 | 3
  2 | 2
  2 |  
  2 |  
  5 | 5
(6 rows)

SELECT * FROM test_ref_rel ORDER BY i, j /*__spqr__execute_on: sh2 */;
 i  | j 
----+---
 -4 | 4
 -3 | 3
  2 | 2
  2 |  
  2 |  
  5 | 5
(6 rows)

DELETE FROM test_ref_rel WHERE i = 2 /* __spqr__engine_v2: true */;
SELECT * FROM test_ref_rel ORDER BY i, j /*__spqr__execute_on: sh1 */;
 i  | j 
----+---
 -4 | 4
 -3 | 3
  5 | 5
(3 rows)

SELECT * FROM test_ref_rel ORDER BY i, j /*__spqr__execute_on: sh2 */;
 i  | j 
----+---
 -4 | 4
 -3 | 3
  5 | 5
(3 rows)

DROP TABLE test_ref_rel;
\c spqr-console

		SPQR router admin console
	Here you can configure your routing rules
------------------------------------------------
	You can find documentation here 
https://github.com/pg-sharding/spqr/tree/master/docs

DROP DISTRIBUTION ALL CASCADE;
       drop distribution       
-------------------------------
 distribution id -> REPLICATED
(1 row)

DROP KEY RANGE ALL;
 drop key range 
----------------
(0 rows)

